FESTIVAL,Location (State),Month,Description
Magh Bihu (Bhogali Bihu),Assam,January,"<b>ভোগালী বিহু, আনন্দৰ উৎসৱ, খেতি-বৰ্মা ধানৰ উৎসৱ।</b><br>Harvest festival in January featuring feasts, bonfires, and traditional games marking the end of the harvesting season."
Kati Bihu,Assam,October,"<b>কাটি বিহুৰ সোৱণীয়া ৰাতি, দীপালিৰ পোহৰ।</b><br>Festival of lights marking the time of crop protection, with lamps lit in fields and homes for prosperity."
Ali Ai Ligang,Assam (Mising tribe),February,"<b>আলী আই লিগাংত, নৃত্যগীতৰ ৰমণীয়তা।</b><br>Spring festival of the Mising tribe involving folk dance, music, and community feasts welcoming the sowing season."
Jonbeel Mela,Assam,January,"<b>জনবিল মেলাৰ বাণিজ্য, সংস্কৃতিৰ মিলন।</b><br>Traditional fair featuring barter trade among communities, with cultural performances and rituals."
Dehing Patkai Festival,Assam,November,"<b>দেহিং পাতকাইৰ জংঘলৰ উৎসৱ, প্ৰকৃতিৰ সন্মান।</b><br>Festival celebrating the rich biodiversity of the Dehing Patkai rainforest with cultural programs and eco-tourism promotion."
Ambubachi Mela,Assam (Kamakhya Temple),June,"<b>অম্বুবাচী মেলাত, ভক্তিৰ অমিয়া ঢৌ।</b><br>Annual festival at Kamakhya Temple marking the goddess's menstruation period, with devotees gathering for special rituals."
Ganesh Chaturthi,Maharashtra,August-September,"<b>गणपती बाप्पा मोरया, पुढे येऊ नक्की!</b><br>The grand festival celebrating Lord Ganesha’s birth with large public and private celebrations, idol installations, processions, and immersions."
Gudi Padwa,Maharashtra,March-April,"<b>गुढी उभारू नववर्ष साजरा करू!</b><br>Maharashtrian New Year marked by raising the Gudi flag, feasting, and welcoming new beginnings with joy and prayers."
Makar Sankranti,Maharashtra,January,"<b>सकाळच्या सुर्याची मंद चांगली शपथ!</b><br>Harvest festival celebrated with kite flying, sweets made of jaggery and sesame, marking the sun’s northward journey."
Bhimashankar Yatra,Maharashtra (Pune district),January,"<b>भिमाशंकर दर्शनाने मन आनंदित होई!</b><br>Pilgrimage to the Bhimashankar temple, one of the twelve Jyotirlingas, attracting devotees from across the state."
Nag Panchami,Maharashtra,July-August,"<b>नाग देवतेच्या पूजा करु, सापांचा आदर करू!</b><br>Festival honoring snakes with rituals, offerings, and worship to seek protection and blessings."
Shimga (Holi),Maharashtra,March,"<b>शिमगा रंगांचा उत्सव, मस्ती आणि आनंद!</b><br>Maharashtrian version of Holi, celebrated with bonfires, singing, dancing, and throwing colors."
Tulsi Vivah,Maharashtra,October-November,"<b>तुळशी विवाहाचा शुभ मुहूर्त, मंगलमय जीवनाचा प्रारंभ!</b><br>Marriage ceremony of the Tulsi plant with Lord Vishnu’s avatar, symbolizing prosperity and spiritual harmony."
Chhatrapati Shivaji Maharaj Jayanti,Maharashtra,February,"<b>शिवाजी महाराजांची जयंत, वीरतेची गाथा!</b><br>Birth anniversary of the great Maratha king celebrated with cultural programs and patriotic fervor."
Ugadi,Andhra Pradesh,March-April,"<b>ఉగాది పండుగలో కొత్త ఆశలు, సంతోషాలు పుట్టుకొస్తాయి!</b><br>Telugu New Year celebrated with special rituals, mango leaves decorations, and traditional Ugadi Pachadi symbolizing life’s flavors."
Sankranti,Andhra Pradesh,January,"<b>సంక్రాంతి పండుగలో సూర్యుడికి నమస్కారం, పల్లెలో ఉత్సవం!</b><br>Harvest festival marked by kite flying, bonfires, and feasts celebrating the sun's northward journey and agricultural prosperity."
Vinayaka Chavithi,Andhra Pradesh,August-September,"<b>వినాయకుడికి పూజలు, సంతోషాల పర్వదినం!</b><br>Festival dedicated to Lord Ganesha with idol installations, prayers, and community celebrations across Andhra Pradesh."
Makar Sankranti,Andhra Pradesh,January,"<b>సంక్రాంతి సంబరాలు, పొంగల్ వంటలు!</b><br>Harvest festival where people prepare 'Pongal' and celebrate with dances and fairs unique to Andhra culture."
Karthika Masam,Andhra Pradesh,November,"<b>కార్తీక మాసం పూజలు, దీపాల వెలుగులు!</b><br>Month-long festival dedicated to Lord Vishnu and Shiva, observed with lighting lamps and holy rituals at temples and homes."
Pushkaralu,Andhra Pradesh,Once every 12 years per river,"<b>పుష్కరాలులో పవిత్ర గంగ, పుణ్యస్నానం!</b><br>Special river festival celebrated every 12 years, attracting devotees for holy dips in the rivers to cleanse sins."
Bonalu,Andhra Pradesh (Telangana region),July-August,"<b>బోనాలు తియ్యగా, భక్తి పరవశం!</b><br>Though mainly Telangana, also observed in parts of Andhra, dedicated to Goddess Mahakali with offerings, dances, and rituals for protection and prosperity."
Mysore Dasara,Karnataka,September-October,"<b>ಮೈಸೂರು ದಸರಾ, ವಿಜಯದ ಹಬ್ಬ!</b><br>The royal festival celebrating Goddess Chamundeshwari’s victory over evil, famous for grand processions, cultural performances, and illumination of Mysore Palace."
Ugadi,Karnataka,March-April,"<b>ಉಗಾದಿ ಹಬ್ಬ, ಹೊಸ ವರ್ಷಕ್ಕೆ ಹೊಸ ಆಶಗಳು!</b><br>Kannada New Year marked with special dishes like ‘Bevu Bella’ symbolizing life’s bittersweet experiences, and rituals to welcome prosperity."
Karaga,Karnataka (Bangalore),March-April,"<b>ಕಾರಾಗಾ ಹಬ್ಬ, ಸಾಂಪ್ರದಾಯಿಕ ಜಾತ್ರೆ!</b><br>Ancient folk festival dedicated to Goddess Draupadi featuring a night procession with the bearer carrying a decorated floral pyramid on the head."
Hampi Festival,Karnataka (Hampi),January,"<b>ಹಂಪಿ ಹಬ್ಬ, ವಿಜಯನಗರ ಸ್ಮರಣೆ!</b><br>Cultural festival celebrating the heritage of the Vijayanagara Empire with music, dance, and heritage walks in the historic ruins."
Kambala,Karnataka (Coastal districts),November-February,"<b>ಕಂಬಳದ ಸ್ಪರ್ಧೆ, ನೈಸರ್ಗಿಕ ಕ್ರೀಡೆ!</b><br>Traditional buffalo race held in paddy fields as thanksgiving for a good harvest and entertainment."
Nagamandala,Karnataka (Coastal and Malnad),June-July,"<b>ನಾಗಮಂಡಳ, ನೃತ್ಯ ಮತ್ತು ನಾಟಕದ ಸಂಭ್ರಮ!</b><br>Folk ritualistic dance-drama dedicated to serpent worship, involving vibrant costumes and storytelling."
Vairamudi Festival,Karnataka (Melukote),February,"<b>ವೈರಮುದಿ ಹಬ್ಬ, ದೇವರ ಔಭರಣೋತ್ಸವ!</b><br>Annual festival in Melukote where the deity Cheluvanarayana Swamy is adorned with a diamond-studded crown (Vairamudi) and grand celebrations take place."
Pongal,Tamil Nadu,January,"<b>பொங்கலோ பொங்கல்! விதைகள் கனியாக, வாழ்வில் வளமாக!</b><br>Four-day harvest festival thanking the Sun God and cattle, celebrated with boiling the first rice of the season and decorating homes with kolams."
Thai Poosam,Tamil Nadu ,January-February,"<b>கந்தா வாழ்க! பக்தியில் துளியும் சோறு போதாதே!</b><br>Dedicated to Lord Murugan, devotees carry 'kavadi' in pilgrimage and perform acts of devotion and penance."
Aadi Perukku,Tamil Nadu (Cauvery Delta),July-August,"<b>ஆடி பெருக்கு வரவோ நதி வாழ்வோ!</b><br>Celebration of life and water’s abundance, observed by women offering prayers to rivers for prosperity and fertility."
Karthigai Deepam,Tamil Nadu,November-December,"<b>கார்த்திகை தீபம், ஒரு தீபம் வீடெல்லாம்!</b><br>Festival of lights where rows of oil lamps are lit in homes and temples, culminating in the lighting of the giant beacon atop Tiruvannamalai hill."
Chithirai Festival,Tamil Nadu (Madurai),April-May,"<b>மீனாட்சி திருக்கல்யாணம், மதுரையின் மகிழ்ச்சி!</b><br>Marks the celestial wedding of Goddess Meenakshi and Lord Sundareswarar with grand processions and temple rituals in Madurai."
Mahamaham,Tamil Nadu,February-March,"<b>மகாமகம் புனித நீராடல், பாவம் போக்கும் பரிசு!</b><br>Mass spiritual bathing festival celebrated in Kumbakonam’s Mahamaham tank, considered sacred like the Kumbh Mela."
Natyanjali Festival,Tamil Nadu (Chidambaram),February-March,"<b>நடனத்தினால் நாதனைத் தொழுது வாழ்வு!</b><br>Dance festival paying homage to Lord Nataraja through classical performances by Bharatanatyam artists in the Chidambaram temple."
Bastar Dussehra,Chhattisgarh (Jagdalpur),September-October,"<b>यहाँ दशहरा नहीं, आस्था का महासागर बहता है!</b><br>Unlike elsewhere, Bastar Dussehra honors local deities like Danteshwari Mata with 75-day-long tribal rituals, processions, and deep devotion."
Goncha Festival,Chhattisgarh (Bastar),July,"<b>धनुष-बाण से खेलें पर्व, प्रेम से मनाएं धर्म!</b><br>Tribals celebrate Lord Jagannath by mock-fighting with bamboo bows and fruit bullets, reflecting joy and brotherhood."
Hareli Festival,Chhattisgarh,July,"<b>हल चलाओ, हरियाली लाओ!</b><br>Celebrated by farmers to honor nature and agriculture, tools are worshipped, and children play traditional games like 'Gedi' (bamboo stilts)."
Madai Festival,Chhattisgarh (Tribal belts),December-April,"<b>मड़ई में उमड़ता है लोकजीवन का रंग!</b><br>A tribal fair where deities are taken out in processions; includes folk music, dance, and rituals that travel from village to village."
Teeja Festival,Chhattisgarh,August-September,"<b>तीजा व्रत से माँग का सिंदूर गाढ़ा होता है!</b><br>Women observe fasts for marital bliss, singing traditional songs and swinging on decorated swings during the Shravan month."
Champaran Mela,Chhattisgarh (Champaran),January-February,"<b>वल्लभाचार्य की जन्मभूमि, भक्ति से सराबोर भूमि!</b><br>Celebrates the birth of Saint Vallabhacharya with bhajans, satsangs, and large religious gatherings at Champaran."
Pola Festival,Chhattisgarh,August,"<b>बैल पूजन, खेतों की जान का अभिनंदन!</b><br>Festival where farmers worship their bulls, decorate them, and thank them for their role in farming, followed by races and feasts."
Carnival,Goa (Panaji),February,"<b>प्यारा गोवा, नाचो-गाओ, रंगों में खो जाओ!</b><br>Pre-Lenten festival with vibrant parades, music, dancing, and floats, where King Momo leads the festivities in a spirit of joy and indulgence."
Sao Joao Festival,Goa (North Goa),June,"<b>सांव जोआओ, कुओं में कूदो, खुशी में डूबो!</b><br>A monsoon festival honoring St. John the Baptist, where young men jump into wells and ponds wearing floral crowns in a joyful water celebration."
Bonderam Festival,Goa (Divar Island),August,"<b>झंडों की लड़ाई, प्यार की छांव!</b><br>Colorful festival commemorating historical land disputes on Divar Island with mock battles using flags, floats, music, and carnival spirit."
Shigmo,Goa (statewide),March,"<b>शिगमो आई रे! ढोल-नगाड़ों की गूंज सुनाई दे!</b><br>Goa’s traditional spring festival celebrated with folk dances, vibrant processions, and colors, honoring warriors and nature's rebirth."
Feast of St. Francis Xavier,Goa (Old Goa),December,"<b>संत का पर्व, श्रद्धा की लहर!</b><br>Held at Basilica of Bom Jesus, this festival honors Goa's patron saint with mass prayers, pilgrimages, and a grand fair attracting thousands."
Chikhal Kalo,Goa (Marcela),July,"<b>मिट्टी में मस्ती, भक्ति में शक्ति!</b><br>A unique mud festival where locals play games in wet soil, re-enacting Lord Krishna’s childhood while celebrating community bonding."
Zatra of Shantadurga,Goa ,December-January,"<b>शांतादुर्गा आई, भक्तों की भीड़ लाई!</b><br>A grand temple fair celebrating Goddess Shantadurga with palanquins, traditional rituals, and devotional music in Goa’s Hindu temples."
Yaoshang,Manipur,March,"<b>रंगों में रमता मणिपुर, याओशांग लाए भक्ति और मस्ती!</b><br>Manipur’s version of Holi, celebrated with Thabal Chongba (moonlight dance), sports, and cultural programs over five days, blending joy and spirituality."
Lai Haraoba,Manipur (Imphal Valley),April-May,"<b>ईश्वरीय नृत्य, संस्कृति की पूजा!</b><br>Festival honoring traditional deities with ritual dances, music, and storytelling performed by Maibis (priestesses), showcasing creation myths of the Meiteis."
Ningol Chakouba,Manipur,October-November,"<b>बहनों के नाम दावत, भाईयों के दिल से प्यार!</b><br>A family reunion festival where married women are invited by their parents for a grand feast, celebrating the bond between brothers and sisters."
Kang Festival,Manipur (Imphal),July,"<b>कृष्ण की रथयात्रा, श्रद्धा और सजावट का संगम!</b><br>Rath Yatra celebrated by the Vaishnavite Meitei community, involving a nine-day procession of Lord Govindaji’s chariot with devotional songs and offerings."
Cheiraoba,Manipur (Meitei households),April,"<b>नया साल, नई उम्मीदें, नई ऊँचाइयाँ!</b><br>Meitei New Year celebrated with cleaning homes, offering traditional dishes to deities, and symbolic hill-climbing to mark personal growth and renewal."
Heikru Hidongba,Manipur ,September,"<b>नावों की रेस, आस्था की बूँदों में विश्वास!</b><br>A traditional boat race festival celebrated on a sacred moat with religious rituals, symbolizing unity and spiritual merit in the Meitei culture."
Kut Festival,Manipur (Hill districts),November,"<b>फसल की खुशी, जनजातीय रंगीनी!</b><br>A harvest festival celebrated by Kuki-Chin-Mizo tribes with folk dances, songs, traditional games, and community feasting in joy and gratitude."
Shad Suk Mynsiem,Meghalaya (Khasi Hills),April,"<b>नृत्य है आराधना, परंपरा की आत्मा!</b><br>Khasi thanksgiving festival where men and women in traditional attire dance to drumbeats to honor ancestors and seasonal abundance."
Wangala Festival,Meghalaya (Garo Hills),November,"<b>बजाओ ड्रम, गाओ धन्यवाद!</b><br>Garo harvest festival where 100 drums (Nokma) are beaten in rhythm to please the Sun God, featuring dance, music, and food."
Behdeinkhlam Festival,Meghalaya (Jaintia Hills),July,"<b>बीमारियों को बहाओ, समृद्धि को बुलाओ!</b><br>A Jaintia festival to ward off diseases with rituals, symbolic logs, dance, and traditional games for a prosperous community."
Chapchar Kut,Mizoram (statewide),March,"<b>झूम की थकान, उत्सव की पहचान!</b><br>Spring festival after jungle clearing for farming; celebrated with bamboo dance (Cheraw), folk songs, and vibrant attire."
Mim Kut,Mizoram (statewide),August-September,"<b>मक्का की फसल, पूर्वजों की याद!</b><br>Harvest festival dedicated to ancestors, involving offerings of maize, wine, and songs to honor their spirits."
Pawl Kut,Mizoram (statewide),December,"<b>अन्न की पूजा, उत्सव की माया!</b><br>Thanksgiving after rice harvest with family feasts, community dances, and children’s blessings—a vital cultural tradition."
Hornbill Festival,Nagaland (Kisama),December,"<b>नगा संस्कृति का रंगारंग संगम!</b><br>‘Festival of Festivals’ showcasing all Naga tribes with traditional games, dances, food, and crafts in a cultural extravaganza."
Moatsu Festival,Nagaland (Ao tribe region),May,"<b>खेती के बाद मस्ती की बौछार!</b><br>Celebrated after sowing season with Ao Naga songs, dances, and brewing of traditional rice beer in joy and hope."
Sekrenyi Festival,Nagaland (Angami tribe),February,"<b>शुद्धि का पर्व, परंपरा का गौरव!</b><br>Angami cleansing festival involving rituals of purification, feasts, and age-group activities marking moral and physical renewal."
Losar,Sikkim (statewide),February,"<b>नया साल, नई रौशनी!</b><br>Tibetan New Year celebrated with prayers, cham (masked) dances, and rituals in monasteries like Rumtek to usher prosperity and harmony."
Pang Lhabsol,Sikkim (statewide),August-September,"<b>कंचनजंघा की पूजा, भाईचारे की भावना!</b><br>Unique to Sikkim, this festival venerates Mt. Kanchenjunga and the guardian deities with warrior dances and communal prayers."
Saga Dawa,Sikkim (Buddhist communities),May-June,"<b>ध्यान और दया का महोत्सव!</b><br>Celebrates birth, enlightenment, and death of Buddha with processions, butter lamps, and offerings in Buddhist monasteries."
Kharchi Puja,Tripura (Agartala),July,"<b>देवी-देवताओं की विशेष पूजा!</b><br>A major tribal Hindu festival where 14 deities are worshipped with rituals, followed by a week-long fair with cultural performances."
Garia Puja,Tripura (tribal areas),April,"<b>गेरिया देवता, फसल और खुशी लाओ!</b><br>A tribal festival to appease the deity of livestock and prosperity with songs, bamboo dance, and symbolic animal sacrifice."
Ker Puja,Tripura (Agartala and tribal belts),August,"<b>नियम और निष्ठा से पूजन!</b><br>Conducted to protect the state from calamities, this highly disciplined festival restricts movement and activities for spiritual focus."