FESTIVAL,Location (State),Month,Description
Navreh,Kashmiri Pandits,March,"<b>Navreh ayi, nayi roshni lai, Har dil khush rahe, ghar mein sukh suhai.</b><br>Kashmiri Pandit New Year observed with rituals and prayers to Goddess Sharika; unique to Kashmiri Pandit community."
Mehndi Festival,Kashmiri Pandits,April,"<b>Mehndi lagai hatho, rangin ho rang birangi, Khushiyan laaye saath mein, ban jaaye din rangangi.</b><br>Traditional spring festival involving henna application and folk songs, unique to Kashmiri Pandit culture."
Harnai Festival,Kashmir Valley,January,"<b>Thand vich gungunahat, Harnai di mehak, Gayan te nachan naal, jindagi vich rang chad.</b><br>Winter folk festival specific to Kashmir celebrating local culture through traditional music and dances."
Urs Festival,Kashmir Valley,September,"<b>Rooh di awaaz hai, Urs di raat hai, Qawwali di mehfil vich, sab nu baat hai.</b><br>Sufi saint commemorative festival held at shrines like Hazratbal, distinct to Kashmir's Sufi heritage."
Mela Sufi,Kashmir Valley,October,"<b>Sufi di mehfil sajdi, dilaan nu bhaandi, Mehfil vich jashan manaiye, ishq di chaandi.</b><br>Sufi shrine festival unique to Kashmir involving devotional qawwali and community feasts."
Lal Ded Mela,Kashmir Valley,October,"<b>Lal Ded di vani vich, ruh di shanti mile, Kavita di roshni naal, dard bhi khil jaye.</b><br>Cultural-spiritual festival honoring Lal Ded, the mystic poetess, celebrated only in Kashmir."
Amarnath Yatra,PAN India,July,"<b>Amarnath di yatra vich, shraddha di baat hai, Har man di manzil vich, shanti di saath hai.</b><br>Hindu pilgrimage to the Amarnath cave in Kashmir, a religious event unique to the region attracting devotees nationwide."
Losar,Himachal Pradesh & Ladakh,February,"<b>Losar da din aaya, nayi roshni layi, Shanti te khushi naal, jeevan sajaya jai.</b><br>Tibetan Buddhist New Year celebrated mainly in Ladakh and Himachal Pradesh, unique to Himalayan Buddhist culture."
Buddha Purnima,PAN India,November,"<b>Buddha di kirpa naal, man vich sukoon hove, Duniya di roshni vich, pyar hi chhaj jave.</b><br>Buddhist festival celebrating birth, enlightenment, and death of Buddha with prayers and feasts."
Gurpurab,PAN India,November,"<b>Guru Nanak ji da charan, sadi zindagi da raah, Prem naal jeevan vich, mile sadaa saah.</b><br>Sikh festival marking Guru Nanak Dev Ji's birth anniversary, celebrated with prayers and community kitchens."
Christmas,PAN India,December,"<b>Christmas di roshni, sab nu khushi de, Prem te shanti naal, ghar sajaye jaaye.</b><br>Christian festival celebrated with church services, decorations, and feasts."
Lohri,PAN India,January,"<b>Sundri mundri hoye, Lohri di raat vich, Chiriyan di chah makhi de naal, Giddha te bhangra paayiye saath.</b><br>Harvest festival celebrated to mark the end of winter and welcome longer days with bonfires, folk songs, dance, and sweets."
Baisakhi/Vaisakhi,PAN India,April,"<b>Baisakhi da mela lagda, khetan vich khushiyan jagda, Jatti te Jatt di shaan vich, nachda Punjab sara aan.</b><br>Spring harvest festival marking the Punjabi New Year and Sikh community's foundation of Khalsa in 1699."
Maghi,Punjab,January,"<b>Maghi aayi, dharti suhani, Sajde ne yaar te jawani.</b><br>Festival commemorating the martyrdom of 40 Sikh warriors; celebrated with fairs, community feasts, and prayers."
Teej,PAN India,August,"<b>Teej diyan chhaanv'an vich, suhani jhulan lai ke aayi, Sohni te Mahi da pyar, man diyaan gallan samjhai.</b><br>Monsoon festival celebrated by women praying for marital bliss and prosperity, marked by swings, singing, and traditional attire."
Hola Mohalla,Punjab,March,"<b>Hola Mohalla aaya, Sher Punjab de jithe laya, Gatka te shastar da mela, Sikh virse di pehchaan bhaya.</b><br>Sikh festival featuring martial arts displays, poetry, and community gatherings; initiated by Guru Gobind Singh."
Karva Chauth,PAN India,October,"<b>Karva Chauth di raat vich, chann nu vekh ke viyakhan, Sohagan di dua naal, rishte sajde dhan dhan.</b><br>Fasting ritual observed by married women for the long life of their husbands, marked by prayers and moon sighting."
Holi,PAN India,March,"<b>रंगों का त्योहार है होली, मिल-जुल के मनाएं होली, पुरानी दुश्मनी मिटा के, प्रेम के रंग बिखेरें सभी।</b><br>Festival of colors symbolizing the victory of good over evil, celebrated with vibrant color throwing, music, and dance."
Gangore,Haryana,March-April,"<b>गंगोरे की छांव तले, बहनें करें आरती, भाईयों की लंबी उम्र की, करतीं हैं ये प्रार्थना सारी।</b><br>Traditional folk festival mainly in rural Haryana, where unmarried girls pray for the long life of their brothers and future husbands."
Janmashtami,PAN India,August,"<b>माखन चोर कृष्ण का जन्मोत्सव, प्रेम और भक्ति से जग सजीव.</b><br>Celebration of Lord Krishna's birth with fasting, night vigils, and devotional songs."
Surajkund Mela,Haryana,February,"<b>सूरजकुंड का मेला है रंगीन, हस्तशिल्प की सौगात लिए, संस्कृति की शान बढ़ाए, हर दिल को ये खुशी दे।</b><br>Annual crafts fair held near Faridabad showcasing traditional arts, crafts, and cultural performances unique to Haryana."
Kullu Dussehra,Himachal Pradesh,October,"<b>कुल्लू दशहरा की रौनक निराली, देवताओं की शोभा और भक्ति भरी बाती।</b><br>Unique month-long festival marking victory of good over evil, with grand processions, music, and cultural programs."
Minjar Mela,Himachal Pradesh,July,"<b>मिंजर मेला आया, खुशियों का सैलाब लाया, खेतों की हरियाली और जनता का त्यौहार बताया।</b><br>Harvest festival celebrated in Chamba district marking prosperity and offering thanks to the gods."
Phagli/Fagli,Himachal Pradesh,March,"<b>फागलि के गीत गाओ, बसंती रंग मनाओ, पर्वतों में होली का त्यौहार मनाओ।</b><br>Spring festival welcoming the new season with traditional songs, dances, and bonfires."
Shoolini Mela,Himachal Pradesh,June,"<b>शूलिनी माता की जय बोलो, खुशियों का मेला मनाओ, पर्वतों की छांव तले प्रेम बांटो।</b><br>Festival honoring Goddess Shoolini with processions, fairs, and devotional singing in Solan district."
Halda,Himachal Pradesh,November,"<b>हलदा के रंग में रंग जाओ, मिट्टी की खुशबू को गाओ, पर्वतों की छांव में त्यौहार मनाओ।</b><br>Festival marking the end of harvest season with folk songs, dances, and rituals."
Mandi Shivratri,Himachal Pradesh,February,"<b>शिव की महिमा गाओ, भक्ति के गीत गाओ, मंडी शिवरात्रि में प्रेम मनाओ।</b><br>Celebrated with night-long prayers and cultural fairs dedicated to Lord Shiva in Mandi district."
Chaitra Suket Fair,Himachal Pradesh,March-April,"<b>चैत्र सूकेत मेला सजाओ, देवताओं का आशीर्वाद पाओ।</b><br>Cultural fair celebrating local deities with traditional music, dance, and rituals."
Raksha Bandhan,PAN India,August,"<b>राखी के बंधन में स्नेह का प्यार, बहन-भाई का अनोखा त्यौहार।</b><br>Celebration of sibling bonds where sisters tie rakhi on brothers' wrists and pray for their well-being."
Kumbh Mela,PAN India,January-April,"<b>स्नान के संग पाप धुलें, कुंभ में हो अमृत बरसें।</b><br>One of the largest religious gatherings in the world, held at Haridwar (Uttarakhand) and Prayagraj (Uttar Pradesh), attracting millions for holy dips in the river."
Nanda Devi Mela,Uttarakhand,September,"<b>नंदा देवी की माया छाई, पर्वतों में खुशहाली लाई।</b><br>Annual festival honoring Goddess Nanda Devi with rituals, fairs, and cultural programs in the Garhwal region."
Makar Sankranti,PAN India,January,"<b>मकर संक्रांति आई, पतंगों का रंग छाई।</b><br>Harvest festival marked by kite flying, feasts, and prayers for prosperity."
Phool Dei,Uttarakhand,March,"<b>फूल देई का त्योहार, बसंत की खुशबू लाई बार-बार।</b><br>Spring festival where girls go door-to-door to bless houses with flowers and songs."
Basant Panchami,PAN India,January-February,"<b>सरस्वती मां की आरती उतारो, विद्या के दीप जलाओ।</b><br>Festival celebrating Goddess Saraswati, goddess of knowledge, with prayers and cultural activities."
Ganga Dussehra,PAN India,May-June,"<b>गंगा माता की पवित्र छाया, पापों को करे हराया।</b><br>Celebrates the descent of the River Ganges to Earth, with holy dips and rituals."
Harela,Uttarakhand,July-August,"<b>हरेला त्योहार, प्रकृति का उपहार, खेती की खुशहाली का उद्धार।</b><br>Agricultural festival marking the onset of monsoon and new crop sowing, with tree planting and prayers."
Ram Navami,PAN India,March-April,"<b>राम नाम का जप लगाओ, जीवन में खुशियाँ लाओ।</b><br>Birth anniversary of Lord Rama celebrated with prayers and recitations of the Ramayana."
Diwali,PAN India,October-November,"<b>दीपों की रौशनी से जगमगाए, अंधकार मिटाए, सुख समृद्धि लाए।</b><br>Festival of lights marking the victory of good over evil, celebrated with lamps, fireworks, and sweets."
Eid-ul-Fitr,PAN India,April-May,"<b>रोज़े की खुशियाँ, ईद की नमाज़ें, दिलों में मोहब्बत की परछाइयां।</b><br>Festival marking the end of Ramadan, celebrated with prayers, feasts, and giving charity."
Mahavir Jayanti,PAN India,April,"<b>अहिंसा का संदेश फैलाए, महावीर की जय गाए।</b><br>Celebrates the birth of Lord Mahavir, founder of Jainism, with prayers and charitable activities."
Navratri,PAN India,September-October,"<b>गरबा की थाप, नवरात्रि का जोश, हर दिल में उत्सव का मौसाम।</b><br>Nine-night festival celebrating Goddess Durga with traditional Garba and Dandiya dances, vibrant attire, and devotional songs."
Uttarayan (Makar Sankranti),Gujarat,January,"<b>पतंगों का त्योहार, आसमान रंगीन, खुशियाँ हर घर में सींमित।</b><br>Harvest festival famous for massive kite-flying competitions, feasts, and social gatherings marking the sun's northward journey."
Rann Utsav,Gujarat,November-February,"<b>थार की रेत पर रंग बिरंगा मेला, संस्कृति की झलक हर कोना।</b><br>Cultural festival in the Rann of Kutch showcasing folk music, dance, crafts, and local traditions in a desert setting."
Dussehra,PAN India,September-October,"<b>रावण दहन की अग्नि में, बुराई का अंत हुआ निश्चित।</b><br>Festival marking the victory of Lord Rama over Ravana, celebrated with processions, effigy burning, and cultural programs."
Sharad Purnima,Gujarat,October,"<b>चाँद की चाँदनी में खुशियाँ छुपाए, शरद पूर्णिमा का त्योहार मनाए।</b><br>Harvest festival celebrated on the full moon night with prayers and night-long celebrations under moonlight."
Tarnetar Fair,Gujarat,August,"<b>टर्नेटर मेला, रंगीन परिधान, लोक संस्कृति की शान।</b><br>Famous tribal fair known for traditional dance, music, and matchmaking ceremonies held near Surendranagar."
Bastar Dussehra,Madhya Pradesh (Bastar),October,"<b>दुर्गा की भक्ति से भरा बसेरा, बस्तर का त्योहार है अनोखा सवेरा।</b><br>Unique 75-day long Dussehra celebrated with tribal rituals, processions, and cultural performances in Bastar region."
Bhojpur Mela,Madhya Pradesh,October-November,"<b>भोपाल के संगम पर, मेलों का रंग चढ़ा, संस्कृति की छटा फैली।</b><br>Annual fair near Bhojpur Temple featuring folk dances, music, and religious rituals attracting locals and tourists."
Khajuraho Dance Festival,Madhya Pradesh,February-March,"<b>नृत्य की छटा बिखेरती, खजुराहो की रजाई।</b><br>Cultural festival showcasing classical Indian dance forms at Khajuraho temples with spectacular performances."
Rajim Kumbh Mela,Madhya Pradesh (Rajim),February,"<b>राजिम कुंभ का मेला, धर्म और आस्था का बसेरा।</b><br>Religious festival held at Rajim, involving holy dips, rituals, and cultural events similar to Kumbh Mela."
Gondwana Festival,Madhya Pradesh (Gond Region),November,"<b>गोंडवाना की संस्कृति में छुपा, त्योहारों का संगम बसा।</b><br>Festival celebrating the culture, art, and heritage of the Gond tribal community with music and dance."
Chhath Puja,PAN India,October-November,"<b>सूरज देवता की आराधना, छठ पूजा का सुहाना मेला।</b><br>Major festival dedicated to the Sun God and Chhathi Maiya, involving rigorous fasting, holy dips, and evening and morning prayers on riverbanks."
Sama Chakeva,Bihar,November,"<b>भाइयों की छांव तले, बहनों का त्योहार मनाए।</b><br>Folk festival celebrating brother-sister relationships with traditional songs, rituals, and colorful decorations symbolizing the bond of love."
Sonepur Mela,Bihar (Sonepur),November,"<b>भारत का सबसे बड़ा मेला, संस्कृति का अनमोल खजाना।</b><br>Asia's largest cattle fair held annually with livestock trading, cultural events, and religious activities."
Durga Puja,PAN India,September-October,"<b>माँ दुर्गा की जयकार, बुरी शक्तियों का संहार।</b><br>Festival celebrating Goddess Durga's victory over evil, with elaborate pandals, rituals, and cultural programs."
Maha Shivaratri,PAN India,February-March,"<b>शिव शंभु की भक्ति में, रात जागे भक्त जन।</b><br>Night-long festival honoring Lord Shiva with fasting, prayers, and special rituals at temples."
Saraswati Puja,PAN India,January-February,"<b>ज्ञान और विद्या की देवी का आह्वान।</b><br>Celebration in honor of Goddess Saraswati, marking the start of the academic year with prayers for wisdom and learning."
Karma Festival,Jharkhand,August-September,"<b>करमा के रंग में झूमे गाँव-दीहात, प्रकृति के गीत गाए।</b><br>Tribal festival celebrating nature worship and the Karma tree, featuring folk dances, songs, and community feasts."
Tusu Festival,Jharkhand,January-February,"<b>तुसू मेला, खुशियों की बयार, संस्कृति का प्यारा त्योहार।</b><br>Harvest festival celebrated by tribal women with folk songs and dances, marking the end of the agricultural season."
Sarhul,Jharkhand,March-April,"<b>सारुल की पूजा में बसा है जीवन, पेड़ों की छाँव में है उत्सव का गीत।</b><br>Tribal New Year and nature worship festival, honoring trees and nature spirits with rituals, dances, and songs."
Jitia,Jharkhand,August-September,"<b>माँ की ममता, जतिया के व्रत में झलकती।</b><br>Fasting festival by mothers praying for the long life and health of their children, observed with rituals and prayers."
Karam Puja,Jharkhand,August-September,"<b>करमा के पत्तों में छुपा है सांस्कृतिक संग, खुशियों का रंग।</b><br>Worship of Karam tree by tribal communities seeking blessings for good harvest and prosperity."
Ram Navami,Jharkhand,March-April,"<b>राम नाम की माला, मन में भक्ति की छाला।</b><br>Celebration of Lord Rama’s birth with devotional songs, processions, and religious ceremonies."
Diwali,Jharkhand,October-November,"<b>दीपों की चमक से जगमगाए घर, खुशियों से भरे हर एक नगर।</b><br>Festival of lights symbolizing victory of good over evil, celebrated with lamps, fireworks, and sweets."
Chhath Puja,Jharkhand,October-November,"<b>सूरज देव की आराधना, छठ पूजा का पावन त्यौहार।</b><br>Major festival dedicated to the Sun God involving fasting, holy baths, and prayers on riverbanks, especially among Maithil and tribal communities."
Baisakhi,Delhi,April,"<b>खुशियों का सैलाब, बैसाखी का त्योहार।</b><br>Harvest festival celebrated with traditional dances, fairs, and prayers marking the Punjabi New Year and beginning of the harvest season."
Diwali,Delhi,October-November,"<b>दीपों की रौशनी से जगमगाए दिल्ली की गलियां।</b><br>Festival of lights symbolizing victory of good over evil, celebrated with lamps, fireworks, and family gatherings."
Holi,Delhi,March,"<b>रंगों की बारिश में भीग जाए दिल्ली का हर गली-मोहल्ला।</b><br>Festival of colors celebrated with vibrant colors, music, dance, and community fun."
Eid-ul-Fitr,Delhi,April-May (varies)," <b>रोज़े खत्म, खुशियों की बहार, ईद का त्यौहार।</b><br>Festival marking the end of Ramadan, celebrated with prayers, feasts, and social gatherings among Muslim communities."
Christmas,Delhi,December,"<b>क्रिसमस की रोशनी में जगमगाए दिल और शहर।</b><br>Celebration of the birth of Jesus Christ with carols, decorations, and community events."
Guru Nanak Jayanti,Delhi,November,"<b>गुरु नानक की महिमा से भरा, प्रकाश पर्व मनाया।</b><br>Birthday of Guru Nanak Dev Ji, founder of Sikhism, marked with prayers, processions, and community kitchens (Langar)."
Lohri,Delhi,January,"<b>लोहड़ी की आग में जले सुख-दुख सारे।</b><br>Traditional Punjabi festival celebrated with bonfires, singing, and dancing marking the end of winter and arrival of longer days."
Raksha Bandhan,Delhi,August,"<b>रिश्तों की डोर, भाई-बहन का प्यार।</b><br>Festival celebrating the bond between brothers and sisters, where sisters tie a protective thread (Rakhi) on brothers' wrists."
Ganesh Chaturthi,Delhi,August-September,"<b>गणपति बप्पा मोरया, हर दिल में बसे है माया।</b><br>Celebration of Lord Ganesha’s birth with prayers, processions, and immersion of idols."
Ratha Yatra,Odisha (Puri),June-July,"<b>भगवान जगन्नाथ का रथ निकले, श्रद्धा और भक्ति से मन झूले।</b><br>Grand chariot festival in Puri where deities Jagannath, Balabhadra, and Subhadra are pulled through the streets amidst huge crowds and celebrations."
Sambalpur Lok Mahotsav,Odisha (Sambalpur),December,"<b>सांस्कृतिक रंगों का संगम, सांबलपुर में उत्सव का आलम।</b><br>Folk festival showcasing tribal dances, music, crafts, and cuisine celebrating Odisha's diverse tribal heritage."
Chhau Dance Festival,Odisha (Mayurbhanj),April,"<b>छाऊ नृत्य की धूम, प्रकृति का संगीत बहुम।</b><br>Traditional masked dance festival blending martial arts and folk traditions, held in Mayurbhanj and neighboring areas."
Makar Mela,Odisha (Bhubaneswar),January,"<b>मकर मेला में उमड़े भक्त, उमंगों से भरा हर एक महाक।</b><br>Religious fair held at Lingaraj Temple attracting devotees with rituals, shopping, and cultural events."
Bali Jatra,Odisha (Cuttack),November,"<b>बाली यात्रा की धूम, नावों से सजी सड़कों में गूंज।</b><br>Festival commemorating ancient maritime trade, featuring boat-shaped stalls, cultural programs, and fairs."
Dola Purnima,Odisha,March,"<b>रंगों की बहार, प्रेम के त्यौहार।</b><br>Festival of colors similar to Holi, celebrated with singing, dancing, and processions honoring Lord Krishna."
Hirakud Festival,Odisha (Sambalpur),November,"<b>हिरकुद की महिमा, संस्कृति की जीवंत धारा।</b><br>Festival celebrating the construction and importance of Hirakud Dam with cultural events and fairs."
Nua Khai,Odisha (Western Odisha),June-July,"<b>नए अन्न का स्वागत, घर-घर खुशियों का वास।</b><br>Harvest festival where new rice is eaten for the first time of the season, marking gratitude for a good harvest."
Durga Puja,West Bengal,September-October,"<b>মা দুর্গার আগমন, বাংলার প্রাণের উৎসব।</b><br>The grandest festival of West Bengal, celebrating Goddess Durga's victory over evil with elaborate pandals, cultural programs, and community feasts."
Poila Boishakh,West Bengal,April,"<b>নতুন বছরের শুরু, নতুন আশা ও আনন্দের ঝড়।</b><br>Bengali New Year marked by cultural events, new clothes, and festive gatherings to welcome prosperity and happiness."
Kali Puja,West Bengal,October-November,"<b>কালী মায়ের ভক্তি, অন্ধকারে আলো জ্বেলে রাখে।</b><br>Festival dedicated to Goddess Kali, celebrated with night-long prayers, lamps, and fireworks, especially in Kolkata and surrounding areas."
Saraswati Puja,West Bengal,January-February,"<b>জ্ঞান দেবী সরস্বতীর আরাধনা, বিদ্যার উৎসব।</b><br>Celebration honoring Goddess Saraswati, the goddess of knowledge, with prayers, cultural programs, and school events."
Rath Yatra,West Bengal ,June-July,"<b>রথযাত্রার রঙিন মেলা, ভক্তদের ভিড় এবং আনন্দ।</b><br>Annual chariot festival of Lord Jagannath, celebrated with processions and festivities unique to the Mahesh area."
Jagadhatri Puja,West Bengal (especially Chandannagar),October,"<b>জগদ্ধাত্রী মা’র পূজা, ঐতিহ্যের দীপ প্রজ্জ্বলন।</b><br>Festival honoring Goddess Jagadhatri, celebrated with grandeur especially in Chandannagar with lights, rituals, and cultural shows."
Nabanna,West Bengal,November,"<b>নবান্ন উৎসব, ফসলের আনন্দ এবং ধান্যতার গান।</b><br>Harvest festival celebrating the new rice crop with folk dances, feasts, and rural fairs in Bengal's villages."
Bishwakarma Puja,West Bengal,September,"<b>বিশ্বকর্মার আরাধনা, কারিগরদের উৎসব।</b><br>Festival honoring Lord Vishwakarma, the divine architect, celebrated by artisans, craftsmen, and factory workers."
Bihu,Assam,April,"<b>বিহুৰ ৰঙত ভৰপূৰ, গাঁও-গাঁৱৰ উৎসৱ।</b><br>Major Assamese harvest festival celebrating new year with folk dances, songs, feasts, and community gatherings."
Rongali Bihu,Assam,April,"<b>নতুন বসনৰ উজ্জ্বলতা, নতুন আশাৰ শুভাৰম্ভ।</b><br>The spring version of Bihu marking the Assamese New Year with vibrant cultural events and joyous celebrations."
