State,Name,Location,Latitude,Longitude,Description,URL,ImageURL
Jharkhand,Palamu Fort,,24.1100,84.1300,"Palamu Fort located in Latehar district Jharkhand comprises two forts built by the Chero kings in the 17th century showcasing rich tribal history.","https://palamu.nic.in/history/","https://upload.wikimedia.org/wikipedia/commons/1/1d/Palamau_Fort.jpg"
Jharkhand,Chandrapura Fort,,23.6833,85.4167,"Chandrapura is a town in Bokaro district Jharkhand known for its thermal power station historical details about a fort are limited.","https://chandrapura.jharkhandonline.in/guide/about-chandrapura","https://redearth.in/blog/wp-content/uploads/2022/01/Chandrapura-Fort-Priya-Nanjappa.jpg"
Jharkhand,Dhanbad Fort,,23.7956,86.4355,"Dhanbad known as the Coal Capital of India has limited historical records of a fort the city's heritage is more industrial.","https://dhanbad.nic.in/","https://content.jdmagicbox.com/comp/varanasi/v8/0542px542.x542.141220175037.u3v8/catalogue/ramnagar-fort-ram-nagar-varanasi-tourist-attraction-42ib5wu.jpg"
Manipur,Kangla Fort,,24.8086,93.9417,"Kangla Fort in Imphal is a historic fort and the ancient capital of Manipur holding significant cultural and political importance.","https://manipur.nic.in/","https://s7ap1.scene7.com/is/image/incredibleindia/kangla-fort-imphal-manipur-1-attr-hero?qlt=82&ts=1727354841373"
Manipur,Bihu Loukon Fort,,24.7833,93.9500,"Bihu Loukon is a star-shaped mud fort in Manipur reflecting the unique fortification style of the region.","https://manipur.nic.in/","https://upload.wikimedia.org/wikipedia/commons/thumb/2/26/Bihu_Loukon_-_Starfort.jpg/640px-Bihu_Loukon_-_Starfort.jpg"
Meghalaya,Khasi Hills Forts (General region),,25.5713,91.8787,"The Khasi Hills region in Meghalaya contains remnants of ancient fortifications and monoliths reflecting the area's tribal heritage.","https://meghalaya.gov.in/","Khasi Hills Forts (General region),Meghalaya"
Mizoram,Chhawrtui Fort,,23.7172,92.7267,"Chhawrtui Fort is an ancient fortification in Mizoram showcasing the traditional defensive structures of the region.","https://mizoram.gov.in/","https://encrypted-tbn0.gstatic.com/images?q=tbn:ANd9GcRLCeB58v4-q0Z-BLRA-bMtl3jeFNH0ImToMw&s"
Nagaland,Kohima War Cemetery (Fort Area),,25.6746,94.1100,"Kohima War Cemetery in Nagaland commemorates the soldiers who died in the Battle of Kohima during World War II.","https://nagaland.gov.in/","https://encrypted-tbn0.gstatic.com/images?q=tbn:ANd9GcRctI3cHLYRtiHxXPJmt_yYsSKM0-t-gSzl1g&s"
Nagaland,Mon Fort,,26.1074,94.8225,"Mon district in Nagaland is known for its tribal heritage specific details about a fort are limited.","https://nagaland.gov.in/","https://thumbs.dreamstime.com/b/historic-khonoma-fort-khonoma-village-nagaland-india-historic-khonoma-fort-khonoma-village-nagaland-india-asia-148303320.jpg"
Sikkim,Rumtek Monastery,,27.3350,88.6000,"Rumtek Monastery is a significant Tibetan Buddhist monastery in Sikkim known for its spiritual importance and architecture.","https://sikkim.gov.in/","https://media.istockphoto.com/id/516034386/photo/the-enchey-monastery.jpg?s=612x612&w=0&k=20&c=cia-IwV5qXeqGomM_KE55a8lu28tmLhANJFpXco7zxQ="
Sikkim,Namgyal Institute of Tibetology (Old Palace area),,27.3335,88.6117,"Namgyal Institute of Tibetology in Sikkim houses a vast collection of Tibetan artifacts and is a center for Buddhist studies.","https://sikkim.gov.in/","https://lh3.googleusercontent.com/gps-cs-s/AC9h4nqTwpxZEPmXw3p_L9Fl31kUqAA-m51Fll8pVhBvFIzwHJR3Y6Z0NaBH4qAJ2rYy2YnBRkBU4SbgxuMel_YwQCJ6NMl_z7JWdgUP97kd1hynZQ5KtGtUnEkUN2KoJ4NMg8xXfLb-=s1360-w1360-h1020"
Sikkim,Pemayangtse Monastery (Fort-like structure),,27.3294,88.3636,"Pemayangtse Monastery in Sikkim is a prominent Buddhist monastery resembling a fort-like structure and holds religious importance.","https://sikkim.gov.in/","https://dynamic-media-cdn.tripadvisor.com/media/photo-o/09/39/80/4e/pemayangtse-monastery.jpg?w=1200&h=1200&s=1"
Tripura,Ujjayanta Palace,,23.8339,91.2811,"Ujjayanta Palace in Agartala Tripura is a former royal palace now serving as a state museum showcasing the region's history.","https://tripura.gov.in/","https://encrypted-tbn0.gstatic.com/images?q=tbn:ANd9GcSvsFGt2hnfucaclI-PF3c8UYz6-t7H7sfEaQ&s"
Tripura,Old Agartala Palace,,23.8367,91.2794,"Old Agartala Palace was the former royal residence before the capital shifted to present-day Agartala remnants reflect its past glory.","https://tripura.gov.in/","https://encrypted-tbn0.gstatic.com/images?q=tbn:ANd9GcQ6t4XKRg2C07cXhBdQxE3KR4rKMtdVFXYJZw&s"
Tripura,Neermahal Palace,,23.8300,91.4803,"Neermahal is a water palace built in the middle of Rudrasagar Lake in Tripura blending Hindu and Islamic architectural styles.","https://tripura.gov.in/","https://s7ap1.scene7.com/is/image/incredibleindia/neer-mahal-agartala-tripura-1-attr-hero?qlt=82&ts=1726651131722"
Kerala,WESTERN GHATS,,11.7459,77.0911,"UNESCO World Heritage site known for its biodiversity and cultural significance","https://whc.unesco.org/en/list/1342/","https://th-i.thgim.com/public/sci-tech/science/yw2ew9/article23761533.ece/alternates/LANDSCAPE_1200/WESTERNGHATS"